STATE,STATENAME,ST_CASE,VE_FORMS,VEH_NO,PER_NO,STR_VEH,COUNTY,DAY,DAYNAME,MONTH,MONTHNAME,HOUR,HOURNAME,MINUTE,MINUTENAME,RUR_URB,RUR_URBNAME,FUNC_SYS,FUNC_SYSNAME,HARM_EV,HARM_EVNAME,MAN_COLL,MAN_COLLNAME,SCH_BUS,SCH_BUSNAME,MAKE,MAKENAME,MAK_MOD,BODY_TYP,BODY_TYPNAME,MOD_YEAR,MOD_YEARNAME,TOW_VEH,TOW_VEHNAME,SPEC_USE,SPEC_USENAME,EMER_USE,EMER_USENAME,ROLLOVER,ROLLOVERNAME,IMPACT1,IMPACT1NAME,FIRE_EXP,FIRE_EXPNAME,AGE,AGENAME,SEX,SEXNAME,PER_TYP,PER_TYPNAME,INJ_SEV,INJ_SEVNAME,SEAT_POS,SEAT_POSNAME,REST_USE,REST_USENAME,REST_MIS,REST_MISNAME,AIR_BAG,AIR_BAGNAME,EJECTION,EJECTIONNAME,EJ_PATH,EJ_PATHNAME,EXTRICAT,EXTRICATNAME,DRINKING,DRINKINGNAME,ALC_DET,ALC_DETNAME,ALC_STATUS,ALC_STATUSNAME,ATST_TYP,ATST_TYPNAME,ALC_RES,ALC_RESNAME,DRUGS,DRUGSNAME,DRUG_DET,DRUG_DETNAME,DSTATUS,DSTATUSNAME,HOSPITAL,HOSPITALNAME,DOA,DOANAME,DEATH_DA,DEATH_DANAME,DEATH_MO,DEATH_MONAME,DEATH_YR,DEATH_YRNAME,DEATH_HR,DEATH_HRNAME,DEATH_MN,DEATH_MNNAME,DEATH_TM,DEATH_TMNAME,LAG_HRS,LAG_HRSNAME,LAG_MINS,LAG_MINSNAME,P_SF1,P_SF1NAME,P_SF2,P_SF2NAME,P_SF3,P_SF3NAME,WORK_INJ,WORK_INJNAME,HISPANIC,HISPANICNAME,LOCATION,LOCATIONNAME,HELM_USE,HELM_USENAME,HELM_MIS,HELM_MISNAME
40,Oklahoma,400012,1,0,1,1,27,7,7,1,January,19,7:00pm-7:59pm,54,54,2,Urban,1,Interstate,8,Pedestrian,0,The First Harmful Event was Not a Collision with a Motor Vehicle in Transport,0,No,NA,NA,NA,NA,NA,NA,NA,NA,NA,NA,NA,NA,NA,NA,NA,NA,NA,NA,NA,39,39 Years,2,Female,5,Pedestrian,4,Fatal Injury (K),0,Not a Motor Vehicle Occupant,96,Not a Motor Vehicle Occupant,8,Not a Motor Vehicle Occupant,97,Not a Motor Vehicle Occupant,8,Not Applicable,0,Ejection Path Not Applicable,0,Not Extricated or Not Applicable,1,Yes (Alcohol Involved),1,"Evidential Test (breath, blood, urine)",2,Test Given,1,Blood,250,0.250 % BAC,9,Reported as Unknown,8,Not Reported,2,Test Given,0,Not Transported,7,Died at Scene,7,7,1,January,2019,2019,19,19:00-19:59,54,54,1954,1954,0,0,0,0,0,None,0,None,0,None,0,No,7,Non-Hispanic,11,"Not at Intersection - On Roadway, Not in Marked Crosswalk",96,Not a Motor Vehicle Occupant,8,Not a Motor Vehicle Occupant
40,Oklahoma,400046,1,0,1,1,109,15,15,2,February,2,2:00am-2:59am,40,40,2,Urban,1,Interstate,8,Pedestrian,0,The First Harmful Event was Not a Collision with a Motor Vehicle in Transport,0,No,NA,NA,NA,NA,NA,NA,NA,NA,NA,NA,NA,NA,NA,NA,NA,NA,NA,NA,NA,23,23 Years,2,Female,5,Pedestrian,4,Fatal Injury (K),0,Not a Motor Vehicle Occupant,96,Not a Motor Vehicle Occupant,8,Not a Motor Vehicle Occupant,97,Not a Motor Vehicle Occupant,8,Not Applicable,0,Ejection Path Not Applicable,0,Not Extricated or Not Applicable,1,Yes (Alcohol Involved),1,"Evidential Test (breath, blood, urine)",2,Test Given,1,Blood,190,0.190 % BAC,8,Not Reported,8,Not Reported,2,Test Given,0,Not Transported,7,Died at Scene,15,15,2,February,2019,2019,2,2:00-2:59,40,40,240,240,0,0,0,0,0,None,0,None,0,None,0,No,7,Non-Hispanic,11,"Not at Intersection - On Roadway, Not in Marked Crosswalk",96,Not a Motor Vehicle Occupant,8,Not a Motor Vehicle Occupant
40,Oklahoma,400093,2,1,1,0,109,1,1,3,March,2,2:00am-2:59am,9,9,2,Urban,1,Interstate,12,Motor Vehicle In-Transport,2,Front-to-Front,0,No,20,Chevrolet,"Chevrolet C, K, R, V-series pickup/Silverado",34,Light Pickup,2009,2009,0,No Trailing Units,0,No Special Use,0,Not Applicable,0,No Rollover,12,12 Clock Point,0,No or Not Reported,42,42 Years,2,Female,1,Driver of a Motor Vehicle In-Transport,4,Fatal Injury (K),11,"Front Seat, Left Side",3,Shoulder and Lap Belt Used,0,No Indication of Mis-Use,1,Deployed- Front,0,Not Ejected,0,Ejection Path Not Applicable,1,Extricated,1,Yes (Alcohol Involved),1,"Evidential Test (breath, blood, urine)",2,Test Given,1,Blood,230,0.230 % BAC,9,Reported as Unknown,8,Not Reported,2,Test Given,0,Not Transported,7,Died at Scene,1,1,3,March,2019,2019,2,2:00-2:59,10,10,210,210,0,0,1,1,0,None,0,None,0,None,0,No,7,Non-Hispanic,0,Occupant of a Motor Vehicle,20,Not Applicable,7,None Used/Not Applicable
40,Oklahoma,400152,2,0,1,1,109,6,6,5,May,22,10:00pm-10:59pm,42,42,2,Urban,1,Interstate,8,Pedestrian,0,The First Harmful Event was Not a Collision with a Motor Vehicle in Transport,0,No,NA,NA,NA,NA,NA,NA,NA,NA,NA,NA,NA,NA,NA,NA,NA,NA,NA,NA,NA,38,38 Years,2,Female,5,Pedestrian,4,Fatal Injury (K),0,Not a Motor Vehicle Occupant,96,Not a Motor Vehicle Occupant,8,Not a Motor Vehicle Occupant,97,Not a Motor Vehicle Occupant,8,Not Applicable,0,Ejection Path Not Applicable,0,Not Extricated or Not Applicable,1,Yes (Alcohol Involved),1,"Evidential Test (breath, blood, urine)",2,Test Given,1,Blood,240,0.240 % BAC,9,Reported as Unknown,8,Not Reported,2,Test Given,0,Not Transported,7,Died at Scene,6,6,5,May,2019,2019,22,22:00-22:59,46,46,2246,2246,0,0,4,4,0,None,0,None,0,None,0,No,7,Non-Hispanic,11,"Not at Intersection - On Roadway, Not in Marked Crosswalk",96,Not a Motor Vehicle Occupant,8,Not a Motor Vehicle Occupant
40,Oklahoma,400413,2,1,1,0,109,25,25,8,August,18,6:00pm-6:59pm,5,5,2,Urban,1,Interstate,12,Motor Vehicle In-Transport,1,Front-to-Rear,0,No,20,Chevrolet,Chevrolet Suburban (from 1950-2003;see 422 for 2004 on),16,"Utility station wagon (includes suburban limousines, Suburban, Travellall, Grand Wagoneer)",2001,2001,0,No Trailing Units,0,No Special Use,0,Not Applicable,0,No Rollover,12,12 Clock Point,0,No or Not Reported,25,25 Years,2,Female,1,Driver of a Motor Vehicle In-Transport,2,Suspected Minor Injury (B),11,"Front Seat, Left Side",3,Shoulder and Lap Belt Used,0,No Indication of Mis-Use,99,Reported as Deployment Unknown,0,Not Ejected,0,Ejection Path Not Applicable,0,Not Extricated or Not Applicable,1,Yes (Alcohol Involved),1,"Evidential Test (breath, blood, urine)",2,Test Given,1,Blood,229,0.229 % BAC,8,Not Reported,8,Not Reported,0,Test Not Given,5,EMS Ground,0,Not Applicable,88,Not Applicable (Non-Fatal),88,Not Applicable (Non-Fatal),8888,Not Applicable (Non-fatal),88,Not Applicable (Non-fatal),88,Not Applicable (Non-fatal),8888,Not Applicable (Non-fatal),999,Unknown,99,Unknown,0,None,0,None,0,None,8,Not Applicable (not a fatality),0,Not A Fatality (not Applicable),0,Occupant of a Motor Vehicle,20,Not Applicable,7,None Used/Not Applicable
40,Oklahoma,400480,2,0,1,1,17,16,16,11,November,2,2:00am-2:59am,4,4,2,Urban,1,Interstate,12,Motor Vehicle In-Transport,6,Angle,0,No,NA,NA,NA,NA,NA,NA,NA,NA,NA,NA,NA,NA,NA,NA,NA,NA,NA,NA,NA,25,25 Years,2,Female,5,Pedestrian,4,Fatal Injury (K),0,Not a Motor Vehicle Occupant,96,Not a Motor Vehicle Occupant,8,Not a Motor Vehicle Occupant,97,Not a Motor Vehicle Occupant,8,Not Applicable,0,Ejection Path Not Applicable,0,Not Extricated or Not Applicable,8,Not Reported,9,Not Reported,2,Test Given,1,Blood,320,0.320 % BAC,8,Not Reported,8,Not Reported,2,Test Given,0,Not Transported,7,Died at Scene,16,16,11,November,2019,2019,2,2:00-2:59,4,4,204,204,0,0,0,0,0,None,0,None,0,None,0,No,7,Non-Hispanic,11,"Not at Intersection - On Roadway, Not in Marked Crosswalk",96,Not a Motor Vehicle Occupant,8,Not a Motor Vehicle Occupant
