STATE,STATENAME,ST_CASE,VE_FORMS,VEH_NO,PER_NO,STR_VEH,COUNTY,DAY,DAYNAME,MONTH,MONTHNAME,HOUR,HOURNAME,MINUTE,MINUTENAME,RUR_URB,RUR_URBNAME,FUNC_SYS,FUNC_SYSNAME,HARM_EV,HARM_EVNAME,MAN_COLL,MAN_COLLNAME,SCH_BUS,SCH_BUSNAME,MAKE,MAKENAME,MAK_MOD,BODY_TYP,BODY_TYPNAME,MOD_YEAR,MOD_YEARNAME,TOW_VEH,TOW_VEHNAME,SPEC_USE,SPEC_USENAME,EMER_USE,EMER_USENAME,ROLLOVER,ROLLOVERNAME,IMPACT1,IMPACT1NAME,FIRE_EXP,FIRE_EXPNAME,AGE,AGENAME,SEX,SEXNAME,PER_TYP,PER_TYPNAME,INJ_SEV,INJ_SEVNAME,SEAT_POS,SEAT_POSNAME,REST_USE,REST_USENAME,REST_MIS,REST_MISNAME,AIR_BAG,AIR_BAGNAME,EJECTION,EJECTIONNAME,EJ_PATH,EJ_PATHNAME,EXTRICAT,EXTRICATNAME,DRINKING,DRINKINGNAME,ALC_DET,ALC_DETNAME,ALC_STATUS,ALC_STATUSNAME,ATST_TYP,ATST_TYPNAME,ALC_RES,ALC_RESNAME,DRUGS,DRUGSNAME,DRUG_DET,DRUG_DETNAME,DSTATUS,DSTATUSNAME,DRUGTST1,DRUGTST1NAME,DRUGTST2,DRUGTST2NAME,DRUGTST3,DRUGTST3NAME,DRUGRES1,DRUGRES1NAME,DRUGRES2,DRUGRES2NAME,DRUGRES3,DRUGRES3NAME,HOSPITAL,HOSPITALNAME,DOA,DOANAME,DEATH_DA,DEATH_DANAME,DEATH_MO,DEATH_MONAME,DEATH_YR,DEATH_YRNAME,DEATH_HR,DEATH_HRNAME,DEATH_MN,DEATH_MNNAME,DEATH_TM,DEATH_TMNAME,LAG_HRS,LAG_HRSNAME,LAG_MINS,LAG_MINSNAME,P_SF1,P_SF1NAME,P_SF2,P_SF2NAME,P_SF3,P_SF3NAME,WORK_INJ,WORK_INJNAME,HISPANIC,HISPANICNAME,RACE,RACENAME,LOCATION,LOCATIONNAME
49,Utah,490047,3,1,1,0,49,12,12,3,March,0,0:00am-0:59am,27,27,2,Urban,1,Interstate,1,Rollover/Overturn,0,Not a Collision with Motor Vehicle In-Transport,0,No,20,Chevrolet,Chevrolet S-10/T-10 Pickup,34,Light Pickup,2000,2000,0,No Trailing Units,0,No Special Use,0,Not Applicable,1,"Rollover, Tripped by Object/Vehicle",0,Non-Collision,0,No or Not Reported,33,33 Years,1,Male,1,Driver of a Motor Vehicle In-Transport,4,Fatal Injury (K),11,"Front Seat, Left Side",20,None Used / Not Applicable,0,No,20,Not Deployed,1,Totally Ejected,9,Ejection Path Unknown,0,Not Extricated or Not Applicable,1,Yes (Alcohol Involved),9,Not Reported,2,Test Given,1,Blood,272,0.272 % BAC,0,No (drugs not involved),8,Not Reported,2,Test Given,1,Blood,0,Test Not Given,0,Test Not Given,1,"Tested, No Drugs Found/Negative",0,Test Not Given,0,Test Not Given,5,EMS Ground,0,Not Applicable,12,12,3,March,2017,2017,7,7:00-7:59,24,24,724,724,6,6,57,57,0,None,0,None,0,None,0,No,7,Non-Hispanic,1,White,0,Occupant of a Motor Vehicle
49,Utah,490052,3,0,1,1,19,5,5,4,April,0,0:00am-0:59am,15,15,1,Rural,1,Interstate,12,Motor Vehicle In-Transport,11,Other,0,No,NA,NA,NA,NA,NA,NA,NA,NA,NA,NA,NA,NA,NA,NA,NA,NA,NA,NA,NA,57,57 Years,1,Male,5,Pedestrian,4,Fatal Injury (K),0,Not a Motor Vehicle Occupant,96,Not a Motor Vehicle Occupant,8,Not a Motor Vehicle Occupant,97,Not a Motor Vehicle Occupant,8,Not Applicable,0,Ejection Path Not Applicable,0,Not Extricated or Not Applicable,8,Not Reported,9,Not Reported,2,Test Given,1,Blood,29,0.029 % BAC,8,Not Reported,8,Not Reported,2,Test Given,1,Blood,0,Test Not Given,0,Test Not Given,1,"Tested, No Drugs Found/Negative",0,Test Not Given,0,Test Not Given,0,Not Transported,7,Died at Scene,5,5,4,April,2017,2017,1,1:00-1:59,0,0,100,100,0,0,45,45,0,None,0,None,0,None,0,No,7,Non-Hispanic,1,White,11,"Not at Intersection - On Roadway, Not in Marked Crosswalk"
49,Utah,490054,1,1,1,0,35,9,9,4,April,21,9:00pm-9:59pm,2,2,2,Urban,1,Interstate,25,Concrete Traffic Barrier,0,Not a Collision with Motor Vehicle In-Transport,0,No,34,BMW,BMW 750cc and over,80,Two Wheel Motorcycle (excluding motor scooters),2014,2014,0,No Trailing Units,0,No Special Use,0,Not Applicable,0,No Rollover,9,9 Clock Point,0,No or Not Reported,48,48 Years,1,Male,1,Driver of a Motor Vehicle In-Transport,4,Fatal Injury (K),11,"Front Seat, Left Side",17,No Helmet,0,No,20,Not Deployed,8,Not Applicable,0,Ejection Path Not Applicable,0,Not Extricated or Not Applicable,9,Unknown (Police Reported),9,Not Reported,2,Test Given,1,Blood,270,0.270 % BAC,9,Unknown,8,Not Reported,2,Test Given,3,Both: Blood and Urine Tests,1,Blood,0,Test Not Given,605,Tetrahydrocannabinols (THC),395,"""Depressants, Type Unknown""",0,Test Not Given,0,Not Transported,7,Died at Scene,9,9,4,April,2017,2017,21,21:00-21:59,10,10,2110,2110,0,0,8,8,0,None,0,None,0,None,0,No,7,Non-Hispanic,1,White,0,Occupant of a Motor Vehicle
49,Utah,490087,3,1,1,0,49,1,1,6,June,7,7:00am-7:59am,44,44,2,Urban,1,Interstate,12,Motor Vehicle In-Transport,6,Angle,0,No,20,Chevrolet,Chevrolet Monte Carlo (1995 on),2,"2-door sedan,hardtop,coupe",2006,2006,0,No Trailing Units,0,No Special Use,0,Not Applicable,0,No Rollover,9,9 Clock Point,0,No or Not Reported,38,38 Years,1,Male,1,Driver of a Motor Vehicle In-Transport,4,Fatal Injury (K),11,"Front Seat, Left Side",20,None Used / Not Applicable,0,No,1,Deployed- Front,1,Totally Ejected,2,Through Side Window,0,Not Extricated or Not Applicable,9,Unknown (Police Reported),9,Not Reported,2,Test Given,1,Blood,110,0.110 % BAC,9,Unknown,8,Not Reported,2,Test Given,3,Both: Blood and Urine Tests,1,Blood,0,Test Not Given,605,Tetrahydrocannabinols (THC),395,"""Depressants, Type Unknown""",0,Test Not Given,0,Not Transported,7,Died at Scene,1,1,6,June,2017,2017,7,7:00-7:59,44,44,744,744,0,0,0,0,0,None,0,None,0,None,0,No,7,Non-Hispanic,1,White,0,Occupant of a Motor Vehicle
49,Utah,490165,2,1,1,0,35,1,1,9,September,23,11:00pm-11:59pm,6,6,2,Urban,1,Interstate,12,Motor Vehicle In-Transport,2,Front-to-Front,0,No,37,Honda,"Honda Civic/CRX, del Sol",4,"4-door sedan, hardtop",2005,2005,0,No Trailing Units,0,No Special Use,0,Not Applicable,0,No Rollover,12,12 Clock Point,0,No or Not Reported,29,29 Years,1,Male,1,Driver of a Motor Vehicle In-Transport,4,Fatal Injury (K),11,"Front Seat, Left Side",3,Shoulder and Lap Belt Used,0,No,1,Deployed- Front,0,Not Ejected,0,Ejection Path Not Applicable,1,Extricated,1,Yes (Alcohol Involved),9,Not Reported,2,Test Given,1,Blood,210,0.210 % BAC,0,No (drugs not involved),8,Not Reported,2,Test Given,3,Both: Blood and Urine Tests,0,Test Not Given,0,Test Not Given,605,Tetrahydrocannabinols (THC),0,Test Not Given,0,Test Not Given,0,Not Transported,7,Died at Scene,1,1,9,September,2017,2017,23,23:00-23:59,6,6,2306,2306,0,0,0,0,0,None,0,None,0,None,0,No,7,Non-Hispanic,1,White,0,Occupant of a Motor Vehicle
