STATE,STATENAME,ST_CASE,VE_FORMS,VEH_NO,PER_NO,STR_VEH,COUNTY,DAY,DAYNAME,MONTH,MONTHNAME,HOUR,HOURNAME,MINUTE,MINUTENAME,RUR_URB,RUR_URBNAME,FUNC_SYS,FUNC_SYSNAME,HARM_EV,HARM_EVNAME,MAN_COLL,MAN_COLLNAME,SCH_BUS,SCH_BUSNAME,MAKE,MAKENAME,MAK_MOD,MAK_MODNAME,BODY_TYP,BODY_TYPNAME,MOD_YEAR,MOD_YEARNAME,TOW_VEH,TOW_VEHNAME,SPEC_USE,SPEC_USENAME,EMER_USE,EMER_USENAME,ROLLOVER,ROLLOVERNAME,IMPACT1,IMPACT1NAME,FIRE_EXP,FIRE_EXPNAME,AGE,AGENAME,SEX,SEXNAME,PER_TYP,PER_TYPNAME,INJ_SEV,INJ_SEVNAME,SEAT_POS,SEAT_POSNAME,REST_USE,REST_USENAME,REST_MIS,REST_MISNAME,AIR_BAG,AIR_BAGNAME,EJECTION,EJECTIONNAME,EJ_PATH,EJ_PATHNAME,EXTRICAT,EXTRICATNAME,DRINKING,DRINKINGNAME,ALC_DET,ALC_DETNAME,ALC_STATUS,ALC_STATUSNAME,ATST_TYP,ATST_TYPNAME,ALC_RES,ALC_RESNAME,DRUGS,DRUGSNAME,DRUG_DET,DRUG_DETNAME,DSTATUS,DSTATUSNAME,HOSPITAL,HOSPITALNAME,DOA,DOANAME,DEATH_DA,DEATH_DANAME,DEATH_MO,DEATH_MONAME,DEATH_YR,DEATH_YRNAME,DEATH_HR,DEATH_HRNAME,DEATH_MN,DEATH_MNNAME,DEATH_TM,DEATH_TMNAME,LAG_HRS,LAG_HRSNAME,LAG_MINS,LAG_MINSNAME,P_SF1,P_SF1NAME,P_SF2,P_SF2NAME,P_SF3,P_SF3NAME,WORK_INJ,WORK_INJNAME,HISPANIC,HISPANICNAME,RACE,RACENAME,LOCATION,LOCATIONNAME
29,Missouri,290044,1,0,1,1,95,27,27,1,January,19,7:00pm-7:59pm,51,51,2,Urban,1,Interstate,8,Pedestrian,0,Not a Collision with Motor Vehicle In-Transport,0,No,NA,NA,NA,NA,NA,NA,NA,NA,NA,NA,NA,NA,NA,NA,NA,NA,NA,NA,NA,NA,36,36 Years,2,Female,5,Pedestrian,4,Fatal Injury (K),0,Not a Motor Vehicle Occupant,96,Not a Motor Vehicle Occupant,8,Not a Motor Vehicle Occupant,97,Not a Motor Vehicle Occupant,8,Not Applicable,0,Ejection Path Not Applicable,0,Not Extricated or Not Applicable,9,Reported as Unknown,9,Not Reported,2,Test Given,1,Blood,102,0.102 % BAC,8,Not Reported,8,Not Reported,2,Test Given,0,Not Transported,7,Died at Scene,27,27,1,January,2018,2018,19,19:00-19:59,51,51,1951,1951,0,0,0,0,0,None,0,None,0,None,0,No,7,Non-Hispanic,1,White,11,"Not at Intersection - On Roadway, Not in Marked Crosswalk"
29,Missouri,290108,2,1,1,0,189,3,3,3,March,1,1:00am-1:59am,19,19,2,Urban,1,Interstate,12,Motor Vehicle In-Transport,2,Front-to-Front,0,No,14,Mercury,14021,Mercury Milan,4,"4-door sedan, hardtop",2006,2006,0,No Trailing Units,0,No Special Use,0,Not Applicable,0,No Rollover,12,12 Clock Point,1,Yes,37,37 Years,2,Female,1,Driver of a Motor Vehicle In-Transport,4,Fatal Injury (K),11,"Front Seat, Left Side",99,Reported as Unknown,0,No,99,Reported as Deployment Unknown,0,Not Ejected,0,Ejection Path Not Applicable,0,Not Extricated or Not Applicable,9,Reported as Unknown,9,Not Reported,2,Test Given,1,Blood,294,0.294 % BAC,8,Not Reported,8,Not Reported,2,Test Given,0,Not Transported,7,Died at Scene,3,3,3,March,2018,2018,1,1:00-1:59,30,30,130,130,0,0,11,11,0,None,0,None,0,None,0,No,7,Non-Hispanic,2,Black,0,Occupant of a Motor Vehicle
29,Missouri,290391,3,1,1,0,189,1,1,6,June,23,11:00pm-11:59pm,20,20,2,Urban,1,Interstate,12,Motor Vehicle In-Transport,1,Front-to-Rear,0,No,20,Chevrolet,20022,Chevrolet Cobalt,2,"2-door sedan,hardtop,coupe",2009,2009,0,No Trailing Units,0,No Special Use,0,Not Applicable,0,No Rollover,12,12 Clock Point,0,No or Not Reported,53,53 Years,2,Female,1,Driver of a Motor Vehicle In-Transport,4,Fatal Injury (K),11,"Front Seat, Left Side",3,Shoulder and Lap Belt Used,0,No,1,Deployed- Front,0,Not Ejected,0,Ejection Path Not Applicable,0,Not Extricated or Not Applicable,9,Reported as Unknown,9,Not Reported,2,Test Given,1,Blood,134,0.134 % BAC,8,Not Reported,8,Not Reported,2,Test Given,5,EMS Ground,0,Not Applicable,2,2,6,June,2018,2018,0,0:00-0:59,7,7,7,7,0,0,47,47,0,None,0,None,0,None,0,No,7,Non-Hispanic,2,Black,0,Occupant of a Motor Vehicle
29,Missouri,290505,2,1,1,0,37,8,8,8,August,3,3:00am-3:59am,20,20,2,Urban,1,Interstate,12,Motor Vehicle In-Transport,2,Front-to-Front,0,No,20,Chevrolet,20037,Chevrolet Malibu/Malibu Maxx,4,"4-door sedan, hardtop",2011,2011,0,No Trailing Units,0,No Special Use,0,Not Applicable,0,No Rollover,12,12 Clock Point,0,No or Not Reported,29,29 Years,2,Female,1,Driver of a Motor Vehicle In-Transport,4,Fatal Injury (K),11,"Front Seat, Left Side",20,None Used / Not Applicable,0,No,1,Deployed- Front,0,Not Ejected,0,Ejection Path Not Applicable,0,Not Extricated or Not Applicable,1,Yes (Alcohol Involved),9,Not Reported,2,Test Given,1,Blood,237,0.237 % BAC,8,Not Reported,8,Not Reported,2,Test Given,5,EMS Ground,0,Not Applicable,8,8,8,August,2018,2018,4,4:00-4:59,6,6,406,406,0,0,46,46,0,None,0,None,0,None,0,No,7,Non-Hispanic,2,Black,0,Occupant of a Motor Vehicle
29,Missouri,290837,1,0,1,1,47,25,25,12,December,19,7:00pm-7:59pm,16,16,2,Urban,1,Interstate,8,Pedestrian,0,Not a Collision with Motor Vehicle In-Transport,0,No,NA,NA,NA,NA,NA,NA,NA,NA,NA,NA,NA,NA,NA,NA,NA,NA,NA,NA,NA,NA,50,50 Years,2,Female,5,Pedestrian,4,Fatal Injury (K),0,Not a Motor Vehicle Occupant,96,Not a Motor Vehicle Occupant,8,Not a Motor Vehicle Occupant,97,Not a Motor Vehicle Occupant,8,Not Applicable,0,Ejection Path Not Applicable,0,Not Extricated or Not Applicable,9,Reported as Unknown,9,Not Reported,2,Test Given,1,Blood,181,0.181 % BAC,8,Not Reported,8,Not Reported,2,Test Given,0,Not Transported,7,Died at Scene,25,25,12,December,2018,2018,19,19:00-19:59,16,16,1916,1916,0,0,0,0,0,None,0,None,0,None,0,No,7,Non-Hispanic,1,White,11,"Not at Intersection - On Roadway, Not in Marked Crosswalk"
