STATE,STATENAME,ST_CASE,VE_FORMS,VEH_NO,PER_NO,STR_VEH,COUNTY,DAY,DAYNAME,MONTH,MONTHNAME,HOUR,HOURNAME,MINUTE,MINUTENAME,RUR_URB,RUR_URBNAME,FUNC_SYS,FUNC_SYSNAME,HARM_EV,HARM_EVNAME,MAN_COLL,MAN_COLLNAME,SCH_BUS,SCH_BUSNAME,MAKE,MAKENAME,MAK_MOD,BODY_TYP,BODY_TYPNAME,MOD_YEAR,MOD_YEARNAME,TOW_VEH,TOW_VEHNAME,SPEC_USE,SPEC_USENAME,EMER_USE,EMER_USENAME,ROLLOVER,ROLLOVERNAME,IMPACT1,IMPACT1NAME,FIRE_EXP,FIRE_EXPNAME,AGE,AGENAME,SEX,SEXNAME,PER_TYP,PER_TYPNAME,INJ_SEV,INJ_SEVNAME,SEAT_POS,SEAT_POSNAME,REST_USE,REST_USENAME,REST_MIS,REST_MISNAME,AIR_BAG,AIR_BAGNAME,EJECTION,EJECTIONNAME,EJ_PATH,EJ_PATHNAME,EXTRICAT,EXTRICATNAME,DRINKING,DRINKINGNAME,ALC_DET,ALC_DETNAME,ALC_STATUS,ALC_STATUSNAME,ATST_TYP,ATST_TYPNAME,ALC_RES,ALC_RESNAME,DRUGS,DRUGSNAME,DRUG_DET,DRUG_DETNAME,DSTATUS,DSTATUSNAME,DRUGTST1,DRUGTST1NAME,DRUGTST2,DRUGTST2NAME,DRUGTST3,DRUGTST3NAME,DRUGRES1,DRUGRES1NAME,DRUGRES2,DRUGRES2NAME,DRUGRES3,DRUGRES3NAME,HOSPITAL,HOSPITALNAME,DOA,DOANAME,DEATH_DA,DEATH_DANAME,DEATH_MO,DEATH_MONAME,DEATH_YR,DEATH_YRNAME,DEATH_HR,DEATH_HRNAME,DEATH_MN,DEATH_MNNAME,DEATH_TM,DEATH_TMNAME,LAG_HRS,LAG_HRSNAME,LAG_MINS,LAG_MINSNAME,P_SF1,P_SF1NAME,P_SF2,P_SF2NAME,P_SF3,P_SF3NAME,WORK_INJ,WORK_INJNAME,HISPANIC,HISPANICNAME,RACE,RACENAME,LOCATION,LOCATIONNAME
4,Arizona,40009,1,1,1,0,13,13,13,1,January,21,9:00pm-9:59pm,22,22,2,Urban,1,Interstate,23,Bridge Rail (Includes parapet),0,Not a Collision with Motor Vehicle In-Transport,0,No,38,Isuzu,Isuzu Rodeo/ Rodeo Sport,14,"Compact Utility (Utility Vehicle Categories ""Small"" and ""Midsize"")",2001,2001,0,No Trailing Units,0,No Special Use,0,Not Applicable,1,"Rollover, Tripped by Object/Vehicle",12,12 Clock Point,1,Yes,39,39 Years,2,Female,1,Driver of a Motor Vehicle In-Transport,4,Fatal Injury (K),11,"Front Seat, Left Side",99,Unknown,0,No,99,Deployment Unknown,0,Not Ejected,0,Ejection Path Not Applicable,1,Extricated,9,Unknown (Police Reported),9,Not Reported,2,Test Given,1,Blood,190,0.190 % BAC,9,Unknown,8,Not Reported,2,Test Given,1,Blood,0,Test Not Given,0,Test Not Given,1,"Tested, No Drugs Found/Negative",0,Test Not Given,0,Test Not Given,0,Not Transported,7,Died at Scene,13,13,1,January,2016,2016,21,21:00-21:59,22,22,2122,2122,0,0,0,0,0,None,0,None,0,None,0,No,7,Non-Hispanic,2,Black,0,Occupant of a Motor Vehicle
4,Arizona,40111,2,1,1,0,19,19,19,3,March,4,4:00am-4:59am,16,16,2,Urban,1,Interstate,12,Motor Vehicle In-Transport,2,Front-to-Front,0,No,58,Infiniti,Infiniti G25/G35/G37,2,"2-door sedan,hardtop,coupe",2004,2004,0,No Trailing Units,0,No Special Use,0,Not Applicable,0,No Rollover,12,12 Clock Point,0,No or Not Reported,26,26 Years,2,Female,1,Driver of a Motor Vehicle In-Transport,4,Fatal Injury (K),11,"Front Seat, Left Side",7,None Used,0,No,20,Not Deployed,1,Totally Ejected,1,Through Side Door Opening,0,Not Extricated or Not Applicable,9,Unknown (Police Reported),9,Not Reported,2,Test Given,1,Blood,248,0.248 % BAC,9,Unknown,8,Not Reported,2,Test Given,1,Blood,0,Test Not Given,0,Test Not Given,996,Other Drug,0,Test Not Given,0,Test Not Given,0,Not Transported,7,Died at Scene,19,19,3,March,2016,2016,4,4:00-4:59,16,16,416,416,0,0,0,0,0,None,0,None,0,None,0,No,1,Mexican,1,White,0,Occupant of a Motor Vehicle
4,Arizona,40315,3,0,2,1,25,7,7,5,May,9,9:00am-9:59am,48,48,1,Rural,1,Interstate,12,Motor Vehicle In-Transport,6,Angle,0,No,NA,NA,NA,NA,NA,NA,NA,NA,NA,NA,NA,NA,NA,NA,NA,NA,NA,NA,NA,58,58 Years,2,Female,5,Pedestrian,4,Fatal Injury (K),0,Not a Motor Vehicle Occupant,96,Not a Motor Vehicle Occupant,8,Not a Motor Vehicle Occupant,97,Not a Motor Vehicle Occupant,8,Not Applicable,0,Ejection Path Not Applicable,0,Not Extricated or Not Applicable,0,No (Alcohol Not Involved),9,Not Reported,2,Test Given,1,Blood,118,0.118 % BAC,0,No (drugs not involved),8,Not Reported,2,Test Given,1,Blood,1,Blood,1,Blood,605,Tetrahydrocannabinols (THC),695,"""Cannabinoid, Type Unknown""",996,Other Drug,0,Not Transported,7,Died at Scene,7,7,5,May,2016,2016,9,9:00-9:59,48,48,948,948,0,0,0,0,0,None,0,None,0,None,0,No,7,Non-Hispanic,1,White,11,"Not at Intersection - On Roadway, Not in Marked Crosswalk"
4,Arizona,40435,1,1,3,0,13,10,10,7,July,3,3:00am-3:59am,0,0,2,Urban,1,Interstate,25,Concrete Traffic Barrier,0,Not a Collision with Motor Vehicle In-Transport,0,No,49,Toyota,Toyota Sienna,20,"Minivan (Chrysler Town and Country, Caravan, Grand Caravan, Voyager, Voyager, Honda-Odyssey, ...)",2002,2002,0,No Trailing Units,0,No Special Use,0,Not Applicable,1,"Rollover, Tripped by Object/Vehicle",98,Not Reported,0,No or Not Reported,17,17 Years,2,Female,2,Passenger of a Motor Vehicle In-Transport,4,Fatal Injury (K),32,"Third Seat, Middle",7,None Used,0,No,0,Not Applicable,2,Partially Ejected,9,Ejection Path Unknown,0,Not Extricated or Not Applicable,8,Not Reported,9,Not Reported,2,Test Given,1,Blood,10,0.010 % BAC,8,Not Reported,8,Not Reported,2,Test Given,1,Blood,0,Test Not Given,0,Test Not Given,1,"Tested, No Drugs Found/Negative",0,Test Not Given,0,Test Not Given,0,Not Transported,7,Died at Scene,10,10,7,July,2016,2016,3,3:00-3:59,20,20,320,320,0,0,20,20,0,None,0,None,0,None,0,No,1,Mexican,1,White,0,Occupant of a Motor Vehicle
4,Arizona,40740,2,1,1,0,13,25,25,11,November,2,2:00am-2:59am,30,30,2,Urban,1,Interstate,12,Motor Vehicle In-Transport,2,Front-to-Front,0,No,48,Subaru,Subaru Legacy/Outback(prior to 2003 only; see 045 for 2003 on),4,"4-door sedan, hardtop",2001,2001,0,No Trailing Units,0,No Special Use,0,Not Applicable,0,No Rollover,12,12 Clock Point,0,No or Not Reported,23,23 Years,2,Female,1,Driver of a Motor Vehicle In-Transport,4,Fatal Injury (K),11,"Front Seat, Left Side",99,Unknown,0,No,99,Deployment Unknown,0,Not Ejected,0,Ejection Path Not Applicable,1,Extricated,9,Unknown (Police Reported),9,Not Reported,2,Test Given,1,Blood,170,0.170 % BAC,9,Unknown,8,Not Reported,2,Test Given,1,Blood,0,Test Not Given,0,Test Not Given,1,"Tested, No Drugs Found/Negative",0,Test Not Given,0,Test Not Given,0,Not Transported,7,Died at Scene,25,25,11,November,2016,2016,2,2:00-2:59,30,30,230,230,0,0,0,0,0,None,0,None,0,None,0,No,1,Mexican,1,White,0,Occupant of a Motor Vehicle
